{"schemaVersion":1,"id":"ggd.piv.user-map","vendor":"GetGood Drums","library":"P IV Matt Halpern","variant":"User screenshot map","noteNaming":{"scheme":"kontakt","middleC":"C3"},"source":{"type":"screenshot","description":"User-supplied P IV mapping screenshot"},"groups":[{"id":"kick","label":"Kick","articulations":[{"semanticId":"kick.hit","label":"Hit","kind":"note","bindings":[{"kind":"note","midi":24,"noteName":"C0","role":"primary"}]}]},{"id":"snare","label":"Snare","articulations":[{"semanticId":"snare.hit","label":"Hit","kind":"note","bindings":[{"kind":"note","midi":26,"noteName":"D0","role":"primary"}]},{"semanticId":"snare.flam","label":"Flam","kind":"note","bindings":[{"kind":"note","midi":27,"noteName":"D#0","role":"primary"}]},{"semanticId":"snare.wires_off","label":"Wires Off","kind":"note","bindings":[{"kind":"note","midi":29,"noteName":"F0","role":"primary"}]},{"semanticId":"snare.ruff","label":"Ruff","kind":"note","bindings":[{"kind":"note","midi":28,"noteName":"E0","role":"primary"}]},{"semanticId":"snare.sidestick","label":"Sidestick","kind":"note","bindings":[{"kind":"note","midi":30,"noteName":"F#0","role":"primary"}]}]},{"id":"toms","label":"Toms","articulations":[{"semanticId":"tom.rack_1.hit","label":"Rack Tom 1: Hit","kind":"note","bindings":[{"kind":"note","midi":33,"noteName":"A0","role":"primary"}]},{"semanticId":"tom.rack_2.hit","label":"Rack Tom 2: Hit","kind":"note","bindings":[{"kind":"note","midi":34,"noteName":"A#0","role":"primary"}]},{"semanticId":"tom.floor_1.hit","label":"Floor Tom 1: Hit","kind":"note","bindings":[{"kind":"note","midi":35,"noteName":"B0","role":"primary"}]},{"semanticId":"tom.floor_2.hit","label":"Floor Tom 2: Hit","kind":"note","bindings":[{"kind":"note","midi":36,"noteName":"C1","role":"primary"}]}]},{"id":"aux","label":"Aux","articulations":[{"semanticId":"aux.stick_click","label":"Stick Click","kind":"note","bindings":[{"kind":"note","midi":79,"noteName":"G4","role":"primary"}]}]},{"id":"hats","label":"Hats","articulations":[{"semanticId":"hihat.tip_tight","label":"Tip Tight","kind":"note","bindings":[{"kind":"note","midi":41,"noteName":"F1","role":"primary"}]},{"semanticId":"hihat.edge_tight","label":"Edge Tight","kind":"note","bindings":[{"kind":"note","midi":42,"noteName":"F#1","role":"primary"}]},{"semanticId":"hihat.tip_closed","label":"Tip Closed","kind":"note","bindings":[{"kind":"note","midi":43,"noteName":"G1","role":"primary"}]},{"semanticId":"hihat.edge_closed","label":"Edge Closed","kind":"note","bindings":[{"kind":"note","midi":44,"noteName":"G#1","role":"primary"}]},{"semanticId":"hihat.open_1","label":"Open 1","kind":"note","bindings":[{"kind":"note","midi":45,"noteName":"A1","role":"primary"}]},{"semanticId":"hihat.open_2","label":"Open 2","kind":"note","bindings":[{"kind":"note","midi":46,"noteName":"A#1","role":"primary"}]},{"semanticId":"hihat.open_3","label":"Open 3","kind":"note","bindings":[{"kind":"note","midi":47,"noteName":"B1","role":"primary"}]},{"semanticId":"hihat.pedal","label":"Pedal","kind":"note","bindings":[{"kind":"note","midi":48,"noteName":"C2","role":"primary"}]},{"semanticId":"hihat.pedal_ching","label":"Pedal Ching","kind":"note","bindings":[],"unresolved":true},{"semanticId":"hihat.cc_trigger","label":"CC","kind":"note","bindings":[{"kind":"note","midi":17,"noteName":"F-1","role":"primary"}]}]},{"id":"ride","label":"Ride","articulations":[{"semanticId":"ride.bell","label":"Bell","kind":"note","bindings":[{"kind":"note","midi":61,"noteName":"C#3","role":"primary"}]},{"semanticId":"ride.bow","label":"Ride","kind":"note","bindings":[{"kind":"note","midi":62,"noteName":"D3","role":"primary"}]}]},{"id":"china","label":"China","articulations":[{"semanticId":"china.hit","label":"Hit","kind":"note","bindings":[{"kind":"note","midi":65,"noteName":"F3","role":"primary"}]},{"semanticId":"china.choke","label":"Choke","kind":"note","bindings":[{"kind":"note","midi":66,"noteName":"F#3","role":"primary"}]}]},{"id":"crashes","label":"Crashes","articulations":[{"semanticId":"crash.main_left.hit","label":"Main Crash L: Hit","kind":"note","bindings":[{"kind":"note","midi":52,"noteName":"E2","role":"primary"}]},{"semanticId":"crash.main_left.choke","label":"Main Crash L: Choke","kind":"note","bindings":[{"kind":"note","midi":53,"noteName":"F2","role":"primary"}]},{"semanticId":"crash.wide_left.hit","label":"Wide Crash L: Hit","kind":"note","bindings":[{"kind":"note","midi":56,"noteName":"G#2","role":"primary"}]},{"semanticId":"crash.wide_left.choke","label":"Wide Crash L: Choke","kind":"note","bindings":[{"kind":"note","midi":57,"noteName":"A2","role":"primary"}]},{"semanticId":"crash.main_right.hit","label":"Main Crash R: Hit","kind":"note","bindings":[{"kind":"note","midi":54,"noteName":"F#2","role":"primary"}]},{"semanticId":"crash.main_right.choke","label":"Main Crash R: Choke","kind":"note","bindings":[{"kind":"note","midi":55,"noteName":"G2","role":"primary"}]}]},{"id":"splashes","label":"Splashes","articulations":[{"semanticId":"splash.left.hit","label":"Splash L: Hit","kind":"note","bindings":[{"kind":"note","midi":73,"noteName":"C#4","role":"primary"}]},{"semanticId":"splash.left.choke","label":"Splash L: Choke","kind":"note","bindings":[{"kind":"note","midi":74,"noteName":"D4","role":"primary"}]},{"semanticId":"splash.center.hit","label":"Splash C: Hit","kind":"note","bindings":[{"kind":"note","midi":75,"noteName":"D#4","role":"primary"}]},{"semanticId":"splash.center.choke","label":"Splash C: Choke","kind":"note","bindings":[{"kind":"note","midi":76,"noteName":"E4","role":"primary"}]}]},{"id":"mini_hats","label":"Mini Hats","articulations":[{"semanticId":"mini_hat.hit","label":"Hit","kind":"note","bindings":[{"kind":"note","midi":77,"noteName":"F4","role":"primary"}]}]},{"id":"stack","label":"Stack","articulations":[{"semanticId":"stack.main.hit","label":"Hit","kind":"note","bindings":[{"kind":"note","midi":78,"noteName":"F#4","role":"primary"}]}]}]}