{"schemaVersion":1,"id":"ggd.modern-massive.user-map","vendor":"GetGood Drums","library":"Modern & Massive","variant":"User screenshot map","noteNaming":{"scheme":"kontakt","middleC":"C3"},"source":{"type":"screenshot","description":"User-supplied Modern & Massive mapping screenshot"},"groups":[{"id":"kit","label":"Kit","articulations":[{"semanticId":"kick.hit","label":"Kick","kind":"note","bindings":[{"kind":"note","midi":24,"noteName":"C0","role":"primary"}]},{"semanticId":"snare.flam","label":"Snare - Flam","kind":"note","bindings":[{"kind":"note","midi":27,"noteName":"D#0","role":"primary"}]},{"semanticId":"snare.hit","label":"Snare - Hit","kind":"note","bindings":[{"kind":"note","midi":26,"noteName":"D0","role":"primary"}]},{"semanticId":"snare.ruff","label":"Snare - Ruff","kind":"note","bindings":[{"kind":"note","midi":28,"noteName":"E0","role":"primary"}]},{"semanticId":"snare.sidestick","label":"Snare - Side Stick","kind":"note","bindings":[{"kind":"note","midi":30,"noteName":"F#0","role":"primary"}]},{"semanticId":"snare.wires_off","label":"Snare - Snare Off","kind":"note","bindings":[{"kind":"note","midi":29,"noteName":"F0","role":"primary"}]},{"semanticId":"tom.rack_1.hit","label":"Rack Tom","kind":"note","bindings":[{"kind":"note","midi":33,"noteName":"A0","role":"primary"}]},{"semanticId":"tom.floor_1.hit","label":"Floor Tom 1","kind":"note","bindings":[{"kind":"note","midi":37,"noteName":"C#1","role":"primary"},{"kind":"note","midi":35,"noteName":"B0","role":"alternate"}]},{"semanticId":"tom.floor_2.hit","label":"Floor Tom 2","kind":"note","bindings":[{"kind":"note","midi":39,"noteName":"D#1","role":"primary"}]},{"semanticId":"hihat.tight","label":"Hat - Tight","kind":"note","bindings":[{"kind":"note","midi":45,"noteName":"A1","role":"primary"}]},{"semanticId":"hihat.ching","label":"Hat - Ching","kind":"note","bindings":[{"kind":"note","midi":44,"noteName":"G#1","role":"primary"}]},{"semanticId":"hihat.closed","label":"Hat - Closed","kind":"note","bindings":[{"kind":"note","midi":47,"noteName":"B1","role":"primary"}]},{"semanticId":"hihat.closed_loose","label":"Hat - Closed Loose","kind":"note","bindings":[{"kind":"note","midi":48,"noteName":"C2","role":"primary"}]},{"semanticId":"hihat.open_0","label":"Hat - Open0","kind":"note","bindings":[{"kind":"note","midi":53,"noteName":"F2","role":"primary"}]},{"semanticId":"hihat.open_1","label":"Hat - Open1","kind":"note","bindings":[{"kind":"note","midi":54,"noteName":"F#2","role":"primary"}]}]},{"id":"cymbals_hats","label":"Cymbals & Hats","articulations":[{"semanticId":"hihat.cc","label":"Hat - CC","kind":"control","bindings":[],"unresolved":true},{"semanticId":"hihat.open_2","label":"Hat - Open2","kind":"note","bindings":[{"kind":"note","midi":56,"noteName":"G#2","role":"primary"}]},{"semanticId":"hihat.open_3","label":"Hat - Open3","kind":"note","bindings":[{"kind":"note","midi":58,"noteName":"A#2","role":"primary"}]},{"semanticId":"hihat.pedal","label":"Hat - Pedal Chick","kind":"note","bindings":[{"kind":"note","midi":43,"noteName":"G1","role":"primary"}]},{"semanticId":"ride.bell","label":"Ride - Bell","kind":"note","bindings":[{"kind":"note","midi":74,"noteName":"D4","role":"primary"}]},{"semanticId":"ride.crash","label":"Ride - Crash","kind":"note","bindings":[{"kind":"note","midi":73,"noteName":"C#4","role":"primary"}]},{"semanticId":"ride.tip","label":"Ride - Tip","kind":"note","bindings":[{"kind":"note","midi":72,"noteName":"C4","role":"primary"}]},{"semanticId":"crash.main_left.choke","label":"Crash L - Choke","kind":"note","bindings":[{"kind":"note","midi":64,"noteName":"E3","role":"primary"}]},{"semanticId":"crash.main_left.hit","label":"Crash L - Crash","kind":"note","bindings":[{"kind":"note","midi":62,"noteName":"D3","role":"primary"}]},{"semanticId":"crash.main_right.choke","label":"Crash R - Choke","kind":"note","bindings":[{"kind":"note","midi":69,"noteName":"A3","role":"primary"}]},{"semanticId":"crash.main_right.hit","label":"Crash R - Crash","kind":"note","bindings":[{"kind":"note","midi":67,"noteName":"G3","role":"primary"}]},{"semanticId":"china.choke","label":"China - Choke","kind":"note","bindings":[{"kind":"note","midi":77,"noteName":"F4","role":"primary"}]},{"semanticId":"china.hit","label":"China - Main Hit","kind":"note","bindings":[{"kind":"note","midi":76,"noteName":"E4","role":"primary"}]},{"semanticId":"splash.main.choke","label":"Splash - Choke","kind":"note","bindings":[{"kind":"note","midi":82,"noteName":"A#4","role":"primary"}]},{"semanticId":"splash.main.hit","label":"Splash - Main Hit","kind":"note","bindings":[{"kind":"note","midi":83,"noteName":"B4","role":"primary"}]}]}]}